supplier_code,supplier_name,supplier_product_code,ing.prod_code,ean,product_description,pack_size
1668,SPAR WESTERN CAPE,2995970,23005,,SPAR YB PORK RIBS FRZ P/KG,P/KG
1668,SPAR WESTERN CAPE,2995972,23006,,SPAR YB PORK LEG SQ FRZ P/KG,P/KG
1668,SPAR WESTERN CAPE,3118592,23007,,MALU PORK LIVER,P/KG
1668,SPAR WESTERN CAPE,3401026,23008,,SPAR SLT PORK ESL LOIN ROAST B,1KG
1668,SPAR WESTERN CAPE,3401541,23009,,MALU PORK MEATY BONES FRZ P/KG,1KG
1668,SPAR WESTERN CAPE,3402102,23010,,SPAR SLT PORK ESL STIRFRY P/KG,1KG
1668,SPAR WESTERN CAPE,3402244,23011,,SPAR SLT PORK ESL GOULASH P/KG,1KG
1668,SPAR WESTERN CAPE,3402245,23012,,SPAR SLT PORK ESL BONELESS CHO,1KG
1668,SPAR WESTERN CAPE,2842059,23032,,DELICO LAMB SKILPADJIES,P/KG
1668,SPAR WESTERN CAPE,2842063,23033,,DELICO SKILPADJIES CHIC,P/KG
1668,SPAR WESTERN CAPE,2842065,23034,,DELICO SALAMI STICKS BULK,P/KG
1668,SPAR WESTERN CAPE,2842066,23035,,DELICO CHIC VALLEY KREEF,P/KG
1668,SPAR WESTERN CAPE,2842073,23036,,DELICO TRIPE&TROTTERS,P/KG
1668,SPAR WESTERN CAPE,2842270,23037,,DELICO OFFAL SET POT RDY,P/KG
1668,SPAR WESTERN CAPE,2842275,23038,,DELICO LAMB HEAD WHITE,1'S
1668,SPAR WESTERN CAPE,2842277,23039,212296,SHEEP HEAD CLEAN,P/KG
1668,SPAR WESTERN CAPE,2842279,23040,,DELICO LAMB LEG DEBONED,P/KG
1668,SPAR WESTERN CAPE,2842280,23041,,DELICO LAMB LEG BONE IN,P/KG
1668,SPAR WESTERN CAPE,2842283,23042,,DELICO OXTAILS PORTIONED,P/KG
1668,SPAR WESTERN CAPE,2842285,23043,,DELICO LAMB SHOULDER DEBO,P/KG
1668,SPAR WESTERN CAPE,2843177,23044,,DELICO RIBS LAMB FLANK,P/KG
1668,SPAR WESTERN CAPE,2871992,23045,,DELI CO LAMB HQ SHANK IMP,P/KG
1668,SPAR WESTERN CAPE,2910335,23046,,DELI CO SKILPADJIES WHOLE,P/KG
1668,SPAR WESTERN CAPE,2910507,23047,,DELI CO CHIC THIGH KEB BQ,P/KG
1668,SPAR WESTERN CAPE,2910524,23048,,DELI CO LIVER SHEEP BULK,P/KG
1668,SPAR WESTERN CAPE,2910664,23049,,DELI CO LIVER LAMB P/PK,P/KG
1668,SPAR WESTERN CAPE,2958001,23050,,DELI CO LAMB 6 WAY CUT,P/KG
1668,SPAR WESTERN CAPE,2958300,23051,,DELI CO MUTTON 6 WAY CUT,P/KG
1668,SPAR WESTERN CAPE,2962430,23052,781718493741,LYNCA BELLYRIB BBQ PC,1KG
1668,SPAR WESTERN CAPE,2965277,23053,781718522441,LYNCA RIB SHOULDER COOKED,P/KG
1668,SPAR WESTERN CAPE,2972394,23054,781718493833,LYNCA PC LOIN RIB BBQ,1KG
1668,SPAR WESTERN CAPE,2972409,23055,781718493789,LYNCA PORK BELLYRIBS,P/KG
1668,SPAR WESTERN CAPE,2972413,23056,,LYNCA PORK BELLY BI/RO,P/KG
1668,SPAR WESTERN CAPE,2972415,23057,,LYNCA PORK BELLY DDD,P/KG
1668,SPAR WESTERN CAPE,2972428,23058,,LYNCA PORK LOIN BI/RO,P/KG
1668,SPAR WESTERN CAPE,2972437,23059,,LYNCA PORK NECK DDD,P/KG
1668,SPAR WESTERN CAPE,2972441,23060,,LYNCA PORK SHOULDER RIB,P/KG
1668,SPAR WESTERN CAPE,2972449,23061,,LYNCA PORK TRIM 80/20,P/KG
1668,SPAR WESTERN CAPE,2976608,23062,,LYNCA PORK FILLET,P/KG
1668,SPAR WESTERN CAPE,2976610,23063,,DELI CO SHEEP HEARTS,P/KG
1668,SPAR WESTERN CAPE,2976935,23064,,LYNCA PORK TRIM 80 20 EXP,P/KG
1668,SPAR WESTERN CAPE,2976945,23065,,LYNCA PORK FILLET EXPORT,P/KG
1668,SPAR WESTERN CAPE,2976947,23066,,LYNCA PORK NECK DDD EXP,P/KG
1668,SPAR WESTERN CAPE,2976951,23067,,DELI CO CHICKEN FILLET,P/KG
1668,SPAR WESTERN CAPE,2977694,23068,,DELICO BEEF TRIM 95.5,P/KG
1668,SPAR WESTERN CAPE,2977696,23069,,DELICO BEEF SILVERSIDE A,P/KG
1668,SPAR WESTERN CAPE,2977698,23070,,DELICO BEEF TOPSIDE A,P/KG
1668,SPAR WESTERN CAPE,2978063,23071,,DELI CO SALAMI STICKS,P/KG
1668,SPAR WESTERN CAPE,2978088,23072,,LYNCA PORK SHOULDER BLADE,P/KG
1668,SPAR WESTERN CAPE,2981442,23073,,DELI CO BILTONG BEEF,P/KG
1668,SPAR WESTERN CAPE,2999456,23074,781718537490,DELI CO SALAMI STICKS,200GR
1668,SPAR WESTERN CAPE,3003770,23075,781718537520,DELI CO LAMB TROTTERS POT,P/KG
1668,SPAR WESTERN CAPE,3101436,23076,,LYNCA LARD LEAF,P/KG
1668,SPAR WESTERN CAPE,3109451,23077,,DELI CO HMR BEEF GOULASH,P/KG
1668,SPAR WESTERN CAPE,3109509,23078,,DELI CO HMR BEEF MINCE,P/KG
1668,SPAR WESTERN CAPE,3109627,23079,,DELI CO SHEEP FAT BULK,P/KG
1668,SPAR WESTERN CAPE,3109668,23080,658325647709,DELI CO LAMB SQ SHOULDER,P/KG
1668,SPAR WESTERN CAPE,3109672,23081,,DELI CO LAMB MINI SHOULD,P/KG
1668,SPAR WESTERN CAPE,3120942,23082,,DELICO BEEF CROPS FRESH,P/KG
1668,SPAR WESTERN CAPE,3122087,23083,,DELI CO BEEF RUMP TAILS,P/KG
1668,SPAR WESTERN CAPE,3122089,23084,,DELI CO BEEF RUMP A FRESH,P/KG
1668,SPAR WESTERN CAPE,3122091,23085,659525320249,DELI CO BEEF SIRLOIN A FR,P/KG
1668,SPAR WESTERN CAPE,3122097,23086,,DELI CO BEEF FILLET A FR,P/KG
1668,SPAR WESTERN CAPE,3122099,23087,,DELI CO BEEF FILLET HEADS,P/KG
1668,SPAR WESTERN CAPE,3122100,23088,,DELI CO BEEF RIB EYE FRES,P/KG
1668,SPAR WESTERN CAPE,3122103,23089,,DELI CO BEEF TRIM 90/10 F,P/KG
1668,SPAR WESTERN CAPE,3122129,23090,,DELI CO BEEF S/RIBS FRZ,P/KG
1668,SPAR WESTERN CAPE,3124096,23091,,DELI CO BEEF SHIN SOFT FR,P/KG
1668,SPAR WESTERN CAPE,3124107,23092,,DELI CO BEEF SHIN B/LESS,P/KG
1668,SPAR WESTERN CAPE,3400352,23093,659525364106,DELI-CO LAMB RACK,1KG
1668,SPAR WESTERN CAPE,3432097,23094,,DELI CO BEEF FLANK 70/30 P/KG,1KG
1668,SPAR WESTERN CAPE,3436728,23095,659525971892,LYNCA PORK B/RIB BBQ P/COOKED,7.5KG
1668,SPAR WESTERN CAPE,2849450,23096,6004082002000,BRITOS CHIC MDM,1'S
1668,SPAR WESTERN CAPE,2849452,23097,6004082002024,BRITOS P/BELLY RIBS 10KG,1'S
1668,SPAR WESTERN CAPE,2849454,23098,6004082002031,BRITOS SHEEP LIVER 15KG,1'S
1668,SPAR WESTERN CAPE,2849505,23099,6004082002017,BRITOS CHIC BREAST 15KG,1'S
1668,SPAR WESTERN CAPE,2892818,23100,6004082002055,BRITOS CHIC BREAST PIECES,18.14
1668,SPAR WESTERN CAPE,2905575,23101,6004082002062,BRITOS CHIC DRUMETTES,15KG
1668,SPAR WESTERN CAPE,2955520,23102,6004082002093,BRITOS CHIC MDM DB 945KG,1'S
1668,SPAR WESTERN CAPE,2964990,23103,,BRITOS OX TAIL,P/KG
1668,SPAR WESTERN CAPE,2974629,23104,6004082002116,BRITOS CHIC MDM,15KG
1668,SPAR WESTERN CAPE,3431630,23105,,BRITOS PORK LOIN RIBS P/KG,20KG
1668,SPAR WESTERN CAPE,2848623,23106,,SANDBOS BEEF CLUBSTEAK,P/KG
1668,SPAR WESTERN CAPE,2894467,23107,,SBK BEEF TRIM 90/10 FRESH,P/KG
1668,SPAR WESTERN CAPE,2894468,23108,606110411585,SBK BEEF TRIM 90/10 FRZ,P/KG
1668,SPAR WESTERN CAPE,2894809,23109,,SBK BEEF TRIM 80/20 FRESH,P/KG
1668,SPAR WESTERN CAPE,2894813,23110,,SBK BEEF FILLET B/C FRESH,P/KG
1668,SPAR WESTERN CAPE,2894815,23111,,SBK BEEF NECK FROZEN,P/KG
1668,SPAR WESTERN CAPE,2894829,23112,,SBK BEEF BRISKET C FROZEN,P/KG
1668,SPAR WESTERN CAPE,2894839,23113,,SBK BEEF CHUCK FROZEN,P/KG
1668,SPAR WESTERN CAPE,2894907,23114,,SBK BEEF TOPSIDE C23 FRSH,P/KG
1668,SPAR WESTERN CAPE,2894998,23115,,SBK BEEF S/SIDE C23 FRESH,P/KG
1668,SPAR WESTERN CAPE,2895000,23116,,SBK BEEF S/SIDE C23 FRZ,P/KG
1668,SPAR WESTERN CAPE,2895007,23117,,SBK BEEF S/SIDE C4/6 FRZ,P/KG
1668,SPAR WESTERN CAPE,2897064,23118,,SBK BEEF S/SIDE C4/6 FRSH,P/KG
1668,SPAR WESTERN CAPE,2897139,23119,,SBK BEEF RUMP C23  FRESH,P/KG
1668,SPAR WESTERN CAPE,2897145,23120,,SBK BEEF SIRLOIN C23 FRSH,P/KG
1668,SPAR WESTERN CAPE,2897159,23121,606110223454,SBK BEEF KIDNEY FAT FRZN,P/KG
1668,SPAR WESTERN CAPE,2897162,23122,,SBK BEEF BILTONG D/B FRZ,P/KG
1668,SPAR WESTERN CAPE,2910929,23123,,S/KRAAL D/WORS BEEF,P/KG
1668,SPAR WESTERN CAPE,2944212,23124,6061102234612,SBK MEATY BONES BEEF,P/KG
1668,SPAR WESTERN CAPE,2891331,23125,700083328397,OSTRILAND LEAN TRIM,10KG
1668,SPAR WESTERN CAPE,2891340,23126,,OSTRILAND NECK FRZ,P/KG
1668,SPAR WESTERN CAPE,2934701,23127,,OSTRILAND TRIM FRZ,P/KG
1668,SPAR WESTERN CAPE,2935271,23159,,CC CHIC SPATCHCOCK FRZ,P/KG
1668,SPAR WESTERN CAPE,2938832,23160,6009636980087,CC CHICKENS MALA FROZEN,1KG
1668,SPAR WESTERN CAPE,2938837,23161,6009636980483,CC CHICKENS IQF WINGS,5KG
1668,SPAR WESTERN CAPE,2938841,23162,6009636980490,CC CHICKENS IQF THIGHS,5KG
1668,SPAR WESTERN CAPE,2938844,23163,6009636980452,CC CHICKENS IQF LEG QUART,5KG
1668,SPAR WESTERN CAPE,2948986,23164,6009636980476,CC CHICKENS IQF DRUMS,5KG
1668,SPAR WESTERN CAPE,2966070,23165,,CC CHICKENS SPATCHCOCK,P/KG
1668,SPAR WESTERN CAPE,2970041,23166,6009636980216,CC CHIC FEET CLEAN,10KG
1668,SPAR WESTERN CAPE,2977488,23167,,CC CHICKENS FILLETS UNINJ,P/KG
1668,SPAR WESTERN CAPE,2981903,23168,,CC CHICKENS WHOLEBIRD INJ,P/KG
1668,SPAR WESTERN CAPE,2986212,23169,,CC CHICKENS W 1.4-1.5,P/KG
1668,SPAR WESTERN CAPE,3002406,23170,6009636980629,CC CHICKENS THIGHS FROZEN,10KG
1668,SPAR WESTERN CAPE,3020749,23171,6009636980230,C/CROWN CHIC SPUR WINGS,10KG
1668,SPAR WESTERN CAPE,2953774,23192,,G/PALACE OXTAIL IMPORT,P/KG
1668,SPAR WESTERN CAPE,3002324,23193,6009636980025,GPT CHIC LEG QUART,10KG
1668,SPAR WESTERN CAPE,3030795,23197,737186475413,DAYBREAK IQF CHIC THIGHS,5KG
1668,SPAR WESTERN CAPE,3426355,23198,737186475420,SUPREME CHIC IQF THIGHS 5KG,5KG
1668,SPAR WESTERN CAPE,3015512,23199,2858096152442,MFE SUPREME BRAAIWORS,P/KG
1668,SPAR WESTERN CAPE,2074705,23245,,SPEKENHAM FILLET P/KG,P/KG
1668,SPAR WESTERN CAPE,2074708,23246,,SPEKENHAM LEG ROUND CUT P,P/KG
1668,SPAR WESTERN CAPE,2074709,23247,,WLP PORK NECK B-IN,P/KG
1668,SPAR WESTERN CAPE,2074710,23248,,SPEKENHAM NECK BONELESS P,P/KG
1668,SPAR WESTERN CAPE,2074712,23249,,SPEKENHAM BONE IN BELLY P,P/KG
1668,SPAR WESTERN CAPE,2074713,23250,,WLP BELLY BONEIN RINDLESS,P/KG
1668,SPAR WESTERN CAPE,2074714,23251,,SPEKENHAM LOIN BONELESS P,P/KG
1668,SPAR WESTERN CAPE,2074715,23252,,WLP LOIN BONE IN RINDLESS,P/KG
1668,SPAR WESTERN CAPE,2074716,23253,,SPEKENHAM BELLY BONE IN P,P/KG
1668,SPAR WESTERN CAPE,2074717,23254,,WLP LOIN B-IN R-ON NO-FILLET,P/KG
1668,SPAR WESTERN CAPE,2074720,23255,,SPEKENHAM SHANK KNUCKLE P,P/KG
1668,SPAR WESTERN CAPE,2243691,23256,,SPEKENHAM PORK EISBN/HOCK,P/KG
1668,SPAR WESTERN CAPE,2243699,23257,,WLP 6 CUT BACONER,P/KG
1668,SPAR WESTERN CAPE,2675814,23258,,WLP GAMMON BONE IN,P/KG
1668,SPAR WESTERN CAPE,2675816,23259,,WLP GAMMON BONELESS,P/KG
1668,SPAR WESTERN CAPE,2675884,23260,,WLP PORK EARS EXPOR,P/KG
1668,SPAR WESTERN CAPE,2675913,23261,,WLP PORK TAIL,P/KG
1668,SPAR WESTERN CAPE,2702887,23262,,WLP PORK BANGER,P/KG
1668,SPAR WESTERN CAPE,2702888,23263,,WLP PORK CHIPOLATA,P/KG
1668,SPAR WESTERN CAPE,2702890,23264,,WLP PORK BELLY ROAST,P/KG
1668,SPAR WESTERN CAPE,2918582,23265,,JAN BRAAI B/WORS PORK THN,P/KG
1668,SPAR WESTERN CAPE,3080378,23266,,WLP PORK BACK SPEAK EXP,P/KG
1668,SPAR WESTERN CAPE,2031163,23267,,C/FAIR CHICKEN WHOLE,P/KG
1668,SPAR WESTERN CAPE,2031172,23268,96001164002241,C/FAIR FRSH UNDRESS 10`S,P/KG
1668,SPAR WESTERN CAPE,2031196,23269,2901481267518,C/FAIR FRSH DRUM&THIGH,P/KG
1668,SPAR WESTERN CAPE,2031199,23270,2901411753753,C/FAIR FRESH BREASTS,P/KG
1668,SPAR WESTERN CAPE,2031205,23271,96001164000230,C/FAIR FRESH THIGHS,P/KG
1668,SPAR WESTERN CAPE,2031222,23272,2901428753197,C/FAIR FRSH DRUMSTCKS,P/KG
1668,SPAR WESTERN CAPE,2031223,23273,2901437948447,C/FAIR FRESH WINGS,P/KG
1668,SPAR WESTERN CAPE,2031541,23274,96001164007932,C/FAIR FRSH MINI BRAAI,P/KG
1668,SPAR WESTERN CAPE,2031542,23275,96001164000438,C/FAIR FRSH PARTY PACK,P/KG
1668,SPAR WESTERN CAPE,2107722,23276,2901542169744,C/FAIR FRSH BRSTS FIL 4'S,P/KG
1668,SPAR WESTERN CAPE,2177202,23277,96001164000049,C/FAIR FRSH GRILLERS,P/KG
1668,SPAR WESTERN CAPE,2348406,23278,2812712118564,C/FAIR FRSH BRAAI 10 PCE,P/KG
1668,SPAR WESTERN CAPE,2364418,23279,96001164001565,C/FAIR FRSH BRAAI 5 PIECE,P/KG
1668,SPAR WESTERN CAPE,2613990,23280,,SPAR YB CHKN IN/T NO GIB P/KG,P/KG
1668,SPAR WESTERN CAPE,2613998,23281,2814967047682,SPAR YB CHKN WINGS 8S P/KG,P/KG
1668,SPAR WESTERN CAPE,2614003,23282,,SPAR YB DRUMS/THIGHS P/KG,P/KG
1668,SPAR WESTERN CAPE,2614009,23283,2814871065383,SPAR YB  CHKN BRAAIPK 8 P/KG,P/KG
1668,SPAR WESTERN CAPE,2614011,23284,2814864116177,SPAR YB BREAST FLT 8S P/KG,P/KG
1668,SPAR WESTERN CAPE,2614013,23285,,SPAR YB CHKN IN/B NO GIB P/KG,P/KG
1668,SPAR WESTERN CAPE,2614083,23286,2814919077804,SPAR YB BREAST FLT 4S P/KG,P/KG
1668,SPAR WESTERN CAPE,2614085,23287,2815015045032,SPAR YB CHKN THIGHS 4S P/KG,P/KG
1668,SPAR WESTERN CAPE,2614087,23288,2815194048824,SPAR YB CHKN DRUMS  6S P/KG,P/KG
1668,SPAR WESTERN CAPE,2691205,23289,281279,C/FAIR BREAST BULK FRESH,10P/K
1668,SPAR WESTERN CAPE,2691209,23290,281285,C/FAIR BRAAIPACK8 BULK F,10P/K
1668,SPAR WESTERN CAPE,2691211,23291,281281,C/FAIR DRUMSTICKS BULK F,10P/K
1668,SPAR WESTERN CAPE,2691219,23293,281283,C/FAIR LEG QUARTER BULK F,10P/K
1668,SPAR WESTERN CAPE,2691221,23294,281280,C/FAIR THIGHS BULK F,10P/K
1668,SPAR WESTERN CAPE,2691223,23295,281282,C/FAIR WINGS BULK FRESH,10P/K
1668,SPAR WESTERN CAPE,2737385,23296,2894611035999,SPAR YB CHKN BRAAIPK 5 P/KG,P/KG
1668,SPAR WESTERN CAPE,2737388,23297,,SPAR YB CHKN BRAAIPK 12 P/KG,P/KG
1668,SPAR WESTERN CAPE,2766294,23298,,C/FAIR CHIC W/BIRD RIVERS,P/KG
1668,SPAR WESTERN CAPE,2772439,23299,2815203038808,SPAR YB BREAST B/IN 3S,P/KG
1668,SPAR WESTERN CAPE,2772441,23300,2815212134409,SPAR YB CHKN BRAAIPK 16 P/KG,P/KG
1668,SPAR WESTERN CAPE,2772442,23301,2815229130708,SPAR YB CHKN DBL STAR PK P/KG,P/KG
1668,SPAR WESTERN CAPE,2777781,23302,6001008762581,T&T SPATCHCOCK PERI P,P/KG
1668,SPAR WESTERN CAPE,2777785,23303,6001008762598,T&T SPATCHCOCK BARBEQUE,P/KG
1668,SPAR WESTERN CAPE,2777794,23304,,T&T KEBAB THIGH PERI,P/KG
1668,SPAR WESTERN CAPE,2777799,23305,,T&T KEBAB THIGH BARBEQUE,P/KG
1668,SPAR WESTERN CAPE,2777805,23306,2894720059008,T&T SKEWER WINGS PERI,P/KG
1668,SPAR WESTERN CAPE,2777811,23307,2894732058167,T&T SKEWERED WINGS BBQ,P/KG
1668,SPAR WESTERN CAPE,2777818,23308,2894710044663,T&T BUFLO WINGS PERI,P/KG
1668,SPAR WESTERN CAPE,2777820,23309,2858090130248,T&T BUFFALO WINGS BBQ,P/KG
1668,SPAR WESTERN CAPE,2783085,23310,,SPAR YB CHKN THIGHS 6S P/KG,P/KG
1668,SPAR WESTERN CAPE,2784400,23311,,SPAR YB CHKN MINI FL 12 P/KG,P/KG
1668,SPAR WESTERN CAPE,2790368,23312,,C/FAIR CHEFR CHIC W PREGO,P/KG
1668,SPAR WESTERN CAPE,2790424,23313,,C/READY BRST FRSH LEM&GAR,P/KG
1668,SPAR WESTERN CAPE,2790552,23314,,C/FAIR CHEFR THIGH B/ONIO,P/KG
1668,SPAR WESTERN CAPE,2790554,23315,,C/FAIR CHEFR KEBABS S/BBQ,P/KG
1668,SPAR WESTERN CAPE,2934742,23316,,SPAR SLT SKINPCK LEG 2S P/KG,P/KG
1668,SPAR WESTERN CAPE,2934744,23317,,SPAR SLT SKINPCK FILLETS4 P/KG,P/KG
1668,SPAR WESTERN CAPE,2934747,23318,,SPAR SLT ESL M/FILL 12 P/KG,P/KG
1668,SPAR WESTERN CAPE,2934752,23319,,SPAR SLT SKINPCK BREAST 3 P/KG,P/KG
1668,SPAR WESTERN CAPE,2934756,23320,,SPAR SLT ESL DRUMS 6 P/KG,P/KG
1668,SPAR WESTERN CAPE,2934758,23321,,SPAR SLT ESL THIGHS 4 P/KG,P/KG
1668,SPAR WESTERN CAPE,2934760,23322,,SPAR SLT ESL THIGHS 6 P/KG,P/KG
1668,SPAR WESTERN CAPE,2934762,23323,,SPAR SLT ESL WINGS 8 P/KG,P/KG
1668,SPAR WESTERN CAPE,2934764,23324,,SPAR SLT ESL BRAAI 5 P/KG,P/KG
1668,SPAR WESTERN CAPE,2934788,23325,,SPAR SLT SKINPCK FILLETS8 P/KG,P/KG
1668,SPAR WESTERN CAPE,2934790,23326,,SPAR SLT ESL DRUMS 10 P/KG,P/KG
1668,SPAR WESTERN CAPE,2934792,23327,,SPAR SLT ESL THIGHS 8 P/KG,P/KG
1668,SPAR WESTERN CAPE,2934794,23328,,SPAR SLT ESL STAR PACK P/KG,P/KG
1668,SPAR WESTERN CAPE,2934798,23329,,SPAR SLT ESL BRAAI 8 P/KG,P/KG
1668,SPAR WESTERN CAPE,2957551,23330,2957559062240,T&T CHKN ESPETADA BBQ,P/KG
1668,SPAR WESTERN CAPE,2957556,23331,2957556061239,T&T CHKN ESPETADA P/PERI,P/KG
1668,SPAR WESTERN CAPE,2960173,23332,2925156244277,C/FAIR BRAAIPACK FRSH 3PC,P/KG
1668,SPAR WESTERN CAPE,2963898,23333,,SPAR YB THIGHS B/LES 6P P/KG,P/KG
1668,SPAR WESTERN CAPE,3014077,23334,281301,C/READY CHIC PREGO FRSH,6KG
1668,SPAR WESTERN CAPE,3014079,23335,290163,C/READY CHIC BRST LEM&GAR,8KG
1668,SPAR WESTERN CAPE,3047590,23336,,SPAR YB CHIC THIGHS OYST P/KG,P/KG
1668,SPAR WESTERN CAPE,3068837,23337,,SPAR SLT SKINP BRAAI BRS,P/KG
1668,SPAR WESTERN CAPE,3402060,23338,2813161158545,COUNTY FAIR BREAST FILLETS 12P,1KG
1668,SPAR WESTERN CAPE,2058123,23715,,R/BOW FRS BREASTS 3'S(12),P/KG
1668,SPAR WESTERN CAPE,2058421,23716,,R/BOW FRS WINGS 8'S(12),P/KG
1668,SPAR WESTERN CAPE,2058424,23717,2900490,R/BOW FRS THIGHS 4'S(12),P/KG
1668,SPAR WESTERN CAPE,2058539,23718,,R/BOW FRESH 12PCE BRAAIPACK,P/KG
1668,SPAR WESTERN CAPE,2086308,23719,2814882078655,SPAR FRSH 4 DRUM&4 THIGHS(8),P/KG
1668,SPAR WESTERN CAPE,2195919,23720,2814102205366,F/BROWN FRS DBL BRAAI x4,P/KG
1668,SPAR WESTERN CAPE,2195924,23721,,F/BROWN FRSH THIGHS,P/KG
1668,SPAR WESTERN CAPE,2195926,23722,,F/BROWN FILLETED BREASTS 4'S,P/KG
1668,SPAR WESTERN CAPE,2195931,23723,2824934073224,F/BROWN FRSH WHOLE BIRD,P/KG
1668,SPAR WESTERN CAPE,2195934,23724,,F/BROWN FRSH BRAAI PCK x8,P/KG
1668,SPAR WESTERN CAPE,2195938,23725,,F/BROWN FRSH 4 DRUM/4 THIGH,P/KG
1668,SPAR WESTERN CAPE,2195939,23726,,F/BROWN FRESH WINGS,P/KG
1668,SPAR WESTERN CAPE,2195941,23727,,F/BROWN FRESH DRUMSTICKS,P/KG
1668,SPAR WESTERN CAPE,2230421,23728,,R/BOW FRS D/STICKS 6'S(12),P/KG
1668,SPAR WESTERN CAPE,2233419,23729,,F/BROWN CHICK IN TRAY WOG,P/KG
1668,SPAR WESTERN CAPE,2244879,23730,2824955084988,R/BOW FRSH WHOLE BIRD(10),P/KG
1668,SPAR WESTERN CAPE,2435310,23731,,RAINBOW BRAAIPACK 5PCE,P/KG
1668,SPAR WESTERN CAPE,2533374,23732,,R/BOW FRSH BRAAIPCK 10PCE,P/KG
1668,SPAR WESTERN CAPE,2533376,23733,,RAINBOW FRSH M/STARPACK,P/KG
1668,SPAR WESTERN CAPE,3407877,23734,2824876088409,RAINBOW BRAAI 12PC FRSH,1KG
1668,SPAR WESTERN CAPE,3407944,23735,2900450351166,RAINBOW BREAST FRSH 3PC,1KG
1668,SPAR WESTERN CAPE,3407948,23736,,RAINBOW THIGH FRSH 4PC KG,1KG
1668,SPAR WESTERN CAPE,3407949,23737,2900435858567,RAINBOW WING 8PC FRSH,1KG
1668,SPAR WESTERN CAPE,3407952,23738,2824886098252,F/BROWN BRAAI PK FRSH 8PCE,1KG
1668,SPAR WESTERN CAPE,3407955,23739,2901019353362,F/BROWN THIGH FRSH  P/KG,1KG
1668,SPAR WESTERN CAPE,3407956,23740,,F/BROWN DRUMSTICK FRSH P/K,1KG
1668,SPAR WESTERN CAPE,3407957,23741,2901020259486,F/BROWN WING FRSH  P/KG,1KG
1668,SPAR WESTERN CAPE,3407960,23742,2905251461663,RAINBOW BRAAI 6PC FRSH,1KG
1668,SPAR WESTERN CAPE,3407961,23743,,RAINBOW MINI STAR FRSH P/KG,1KG
1668,SPAR WESTERN CAPE,3408028,23744,2812701137262,F/BROWN BRAAI PK FRSH 16PC P/K,1KG
1668,SPAR WESTERN CAPE,3408031,23745,2824896082319,RAINBOW DRUMS&THIGH FRSH,1KG
1668,SPAR WESTERN CAPE,3408035,23746,2824903067858,F/BROWN DRUMS&THIGHS FRSH 10PC,1KG
1668,SPAR WESTERN CAPE,3408036,23747,2824910068398,RAINBOW BRAAI 10PC FRSH,1KG
1668,SPAR WESTERN CAPE,3408037,23748,2824926089943,F/BROWN CHIC WHL BIRD INTRAY,1KG
1668,SPAR WESTERN CAPE,3408040,23749,,F/BROWN BREAST FILLET FRSH 4PC,1KG
1668,SPAR WESTERN CAPE,3408041,23750,2824933105681,F/BROWN BIRD WHL IN BAG FRSH P,1KG
1668,SPAR WESTERN CAPE,3408877,23751,2905299837628,RAINBOW BRAAI 5PC FRSH,1KG
1668,SPAR WESTERN CAPE,3409261,23752,,RAINBOW DRUMSTICK FRSH  P/K,1KG
1668,SPAR WESTERN CAPE,3415507,23753,2824991181962,R/BOW BREAST FILLET S/L 12PCE,1KG
1668,SPAR WESTERN CAPE,3415578,23754,2905491865870,R/BOW BREASTE FILLET 4PCE,1KG
1668,SPAR WESTERN CAPE,3416355,23755,,F/BROWN SPATCH SMOKEY BBQ,1KG
1668,SPAR WESTERN CAPE,3416356,23756,2824940164428,R/BOW DRUM 8 & THIGH 8 FRSH P/,1KG
1668,SPAR WESTERN CAPE,3416460,23757,,F/BROWN SPATCH PREGO P/KG,1KG
1668,SPAR WESTERN CAPE,3416898,23758,,F/BROWN SPATCH LEM&THY FRSH P/,1KG
1668,SPAR WESTERN CAPE,2234591,23784,6008123000376,K/KAROO OSTRICH FILLET,500G
1668,SPAR WESTERN CAPE,2234595,23785,6008123000383,K/KAROO OSTRICH STEAKS,500G
1668,SPAR WESTERN CAPE,2234602,23786,6008123000406,K/KAROO OSTRICH GOULASH,500G
1668,SPAR WESTERN CAPE,2234604,23787,6008123000444,K/KAROO MINCE OSTRICH,500GR
1668,SPAR WESTERN CAPE,2234609,23788,6008123000420,K/KAROO OSTRICH STK BURGE,500GR
1668,SPAR WESTERN CAPE,2271113,23789,6008123000390,K/KAROO OSTRICH KEBABS,500G
1668,SPAR WESTERN CAPE,2953430,23790,,K/KAROO OST MOROC ESPATAD,P/KG
1668,SPAR WESTERN CAPE,2962806,23941,,RIBCOR OEPSIES,P/KG
1668,SPAR WESTERN CAPE,2962843,23942,,RIBCOR TWISTERS CHEESE,P/KG
1668,SPAR WESTERN CAPE,2962845,23943,,RIBCOR ANGEL KISSES,P/KG
1668,SPAR WESTERN CAPE,2962853,23944,,RIBCOR RIB BURGER B/LESS,P/KG
1668,SPAR WESTERN CAPE,2962855,23945,,RIBCOR RIB BURGER BL BULK,P/KG
1668,SPAR WESTERN CAPE,2962857,23946,,RIBCOR KASSEGRILLER,P/KG
1668,SPAR WESTERN CAPE,2962859,23947,,RIBCOR WORS BACON&CHEESE,P/KG
1668,SPAR WESTERN CAPE,2962861,23948,,RIBCOR GRILLER BAC&CHSE,P/KG
1668,SPAR WESTERN CAPE,2962863,23949,,RIBCOR GRILLER BAC B/FAST,P/KG
1668,SPAR WESTERN CAPE,2962864,23950,,RIBCOR GRILLER CHEESE MED,P/KG
1668,SPAR WESTERN CAPE,2962869,23951,,RIBCOR GRILLER CHS F/LONG,P/KG
1668,SPAR WESTERN CAPE,2962871,23952,,RIBCOR GRILLER CHS FL BLK,P/KG
1668,SPAR WESTERN CAPE,2962879,23953,,RIBCOR GRILLER HAM&CHSE,P/KG
1668,SPAR WESTERN CAPE,2962881,23954,,RIBCOR WORS EGTE ROOK,P/KG
1668,SPAR WESTERN CAPE,2962883,23955,,RIBCOR SMOKIES,P/KG
1668,SPAR WESTERN CAPE,2962891,23956,,RIBCOR  FRANKFURTERS,P/KG
1668,SPAR WESTERN CAPE,2962950,23957,,RIBCOR RUSSIAN CHEESE,P/KG
1668,SPAR WESTERN CAPE,2962952,23958,,RIBCOR RUSSIAN FOOTLONG,P/KG
1668,SPAR WESTERN CAPE,2962954,23959,,RIBCOR RUSSIAN F/LONG BLK,P/KG
1668,SPAR WESTERN CAPE,2962959,23960,,RIBCOR VIENNA CONT CHSE,P/KG
1668,SPAR WESTERN CAPE,2962969,23961,,RIBCOR PORK RASHERS SMK,P/KG
1668,SPAR WESTERN CAPE,2962977,23962,,RIBCOR PORK BELLY RST SMK,P/KG
1668,SPAR WESTERN CAPE,2962980,23963,,RIBCOR EISBEIN SMOKED,P/KG
1668,SPAR WESTERN CAPE,2962987,23964,,RIBCOR NECK PORK STEAK SM,P/KG
1668,SPAR WESTERN CAPE,2962990,23965,,RIBCOR PORK FILLETS SMKD,P/KG
1668,SPAR WESTERN CAPE,2963011,23966,,RIBCOR CHIC BRST FILL SMK,P/KG
1668,SPAR WESTERN CAPE,2963017,23967,,RIBCOR BACON PIECES,P/KG
1668,SPAR WESTERN CAPE,2963027,23968,,RIBCOR BACON PRIME CUT,P/KG
1668,SPAR WESTERN CAPE,2963029,23969,,RIBCOR BACON STREAKY,P/KG
1668,SPAR WESTERN CAPE,2963033,23970,,RIBCOR BACON BACK,P/KG
1668,SPAR WESTERN CAPE,2575282,24195,6001008717772,SPAR SLT LAMB TR/TOT WH,P/KG
1668,SPAR WESTERN CAPE,2575285,24196,6001008717796,SPAR YB LAMB TR/TOT CUT P/KG,P/KG
1668,SPAR WESTERN CAPE,2575286,24197,6001008717802,SPAR SLT LAMB OFFAL CUT,P/KG
1668,SPAR WESTERN CAPE,2575292,24198,6001008717833,SPAR SLT LAMB OFFAL WH,P/KG
1668,SPAR WESTERN CAPE,3064285,24199,,TOMIS LAMB PACK BULK,P/KG
1668,SPAR WESTERN CAPE,2365875,24384,29198010000006,ELGIN F/RANGE WINGS,P/KG
1668,SPAR WESTERN CAPE,2365886,24385,29198050000004,ELGIN F/RANGE BRST FILLETS,P/KG
1668,SPAR WESTERN CAPE,2365890,24386,29198070000008,ELGIN F/RANGE DRUM&THIGH,P/KG
1668,SPAR WESTERN CAPE,2365892,24387,29198040000007,ELGIN F/RANGE DRUMSTICKS,P/KG
1668,SPAR WESTERN CAPE,2365918,24388,29198090000002,ELGIN F/RANGE MINI FILLETS,P/KG
1668,SPAR WESTERN CAPE,2365936,24389,29198030000000,ELGIN F/RANGE THIGHS,P/KG
1668,SPAR WESTERN CAPE,2366807,24390,29198000000009,ELGIN F/RANGE WHOLE BIRD,P/KG
1668,SPAR WESTERN CAPE,2385614,24391,,ELGIN CHICK SAUS GAR&HERB,P/KG
1668,SPAR WESTERN CAPE,2388192,24392,,ELGIN SL THIGH FILLET 8'S,P/KG
1668,SPAR WESTERN CAPE,2416233,24393,2919831036103,FREE RANGE SPICY WINGS,P/KG
1668,SPAR WESTERN CAPE,2512805,24394,,ELGIN F/RANGE CHICKEN LIV,250GR
1668,SPAR WESTERN CAPE,2527594,24395,,ELGIN F/R B/FAST CHIPOLAT,P/KG
1668,SPAR WESTERN CAPE,2574283,24396,,ELGIN CHICKEN BRAAI 5PC,P/KG
1668,SPAR WESTERN CAPE,2747546,24397,29198480000001,KAMEELDORING CHIC SAUSAGE,P/KG
1668,SPAR WESTERN CAPE,2762050,24398,29198500000004,ELGIN CHIC F/R MEATBALLS,P/KG
1668,SPAR WESTERN CAPE,2824570,24399,,ELGIN CHIC F/R KEBAB S/CH,P/KG
1668,SPAR WESTERN CAPE,3420211,24400,6009633270013,ELGIN CHIC F/R CHUNKS 1KG,1KG
1668,SPAR WESTERN CAPE,3420212,24401,6009633270044,ELGIN CHIC F/R LIVERS 1KG,1KG
1668,SPAR WESTERN CAPE,2460163,24456,,LAZENA F/R BIRD NO GIBLET,P/KG
1668,SPAR WESTERN CAPE,2462695,24457,,LAZENA FREE RANGE FILLETS 4'S,P/KG
1668,SPAR WESTERN CAPE,2462701,24458,,LAZENA F/RNG DRUM THIG SL,P/KG
1668,SPAR WESTERN CAPE,2462715,24459,,LAZENA FREE RANGE DRUM,P/KG
1668,SPAR WESTERN CAPE,2462724,24460,,LAZENA F/RANGE MINI BREAST FLT,P/KG
1668,SPAR WESTERN CAPE,2462732,24461,,LAZENA PETIT POUSSON,P/KG
1668,SPAR WESTERN CAPE,2462738,24462,,LAZENA F/RANGE BRAAI PACK,P/KG
1668,SPAR WESTERN CAPE,2462752,24463,,LAZENA FREE RANGE LEG QUARTER,P/KG
1668,SPAR WESTERN CAPE,2463222,24464,,LAZENA FREE RANGE WINGS,P/KG
1668,SPAR WESTERN CAPE,2463226,24465,,LAZENA FREE RANGE THIGHS 4'S,P/KG
1668,SPAR WESTERN CAPE,2463518,24466,,LAZENA FREE RANGE BRAAI,P/KG
1668,SPAR WESTERN CAPE,2503163,24467,6009802289396,LAZENA BRST KEBABS BBQ,P/KG
1668,SPAR WESTERN CAPE,2503176,24468,6009802289402,LAZENA BRST KEBAB P-PERI,P/KG
1668,SPAR WESTERN CAPE,2503178,24469,6009802289389,LAZENA S/COCK PERI-PERI,P/KG
1668,SPAR WESTERN CAPE,2503181,24470,6009802289372,LAZENA S/COCK BBQ,P/KG
1668,SPAR WESTERN CAPE,2503217,24471,6009802289440,LAZENA S/DOWNER WINGS BBQ,P/KG
1668,SPAR WESTERN CAPE,2503231,24472,6009802289457,LAZENA S/DOWNER WING THAI,P/KG
1668,SPAR WESTERN CAPE,2503233,24473,6009802289464,LAZENA COCKTAIL WINGS BBQ,P/KG
1668,SPAR WESTERN CAPE,2503235,24474,6009802289471,LAZENA COCKTAIL WING THAI,P/KG
1668,SPAR WESTERN CAPE,2503245,24475,6009802289433,LAZENA CHICK LIVERS,250GR
1668,SPAR WESTERN CAPE,2540492,24476,2938553104464,FREE RANGE CHICKEN NECKS,P/KG
1668,SPAR WESTERN CAPE,2559880,24477,,F/RANGE CHICKEN BREAST,P/KG
1668,SPAR WESTERN CAPE,2575861,24478,,LAZENA BIRD WHOLE BBQ O/R,P/KG
1668,SPAR WESTERN CAPE,2633125,24479,,FREE RANGE THIGH DEBON,P/KG
1668,SPAR WESTERN CAPE,2705042,24480,2814223045933,LAZENA W/B F/R BBQ,P/KG
1668,SPAR WESTERN CAPE,2705044,24481,2814233045930,LAZENA W/B F/R  PERI PERI,P/KG
1668,SPAR WESTERN CAPE,2705046,24482,2814213045936,LAZENA W/B F/R PLAIN,P/KG
1668,SPAR WESTERN CAPE,2803142,24483,,C/VALLEY WHOLE BIRD,P/KG
1668,SPAR WESTERN CAPE,2893268,24484,,LAZENA CHIC SAUS CHIL CHS,P/KG
1668,SPAR WESTERN CAPE,2893269,24485,,LAZENA CHIC SAUS SMKY CHS,P/KG
1668,SPAR WESTERN CAPE,3076637,24486,,LAZENA F/RANGE DRUM&THIG8,P/KG
1668,SPAR WESTERN CAPE,3088505,24487,,LAZENA WHOLE BIRD F/RANGE,P/KG
1668,SPAR WESTERN CAPE,2600802,24652,6009803741039,SAUCE ON TAP SCE MUSHROOM,4KG
1668,SPAR WESTERN CAPE,2600807,24653,6009803741145,SAUCE ON TAP AFR SPARERIB,10LT
