supplier_code,supplier_name,supplier_product_code,ing.prod_code,ean,product_description,pack_size
1668,SPAR WESTERN CAPE,2844079,2514,6001008777592,SPAR SPICE WORS FARMHOUSE,KG
1668,SPAR WESTERN CAPE,2910757,2527,6001008777615,SPAR SPICE B/WORS KALAHAR,1KG
1668,SPAR WESTERN CAPE,2910759,2528,6001008777240,SPAR SPICE B/WORS GRABOUW,1KG
1668,SPAR WESTERN CAPE,2910761,2529,6001008777264,SPAR SPICE B/WORS OUKRANS,1KG
1668,SPAR WESTERN CAPE,2910767,2530,6001008777233,SPAR SPICE B/WORS ROOIBRG,1KG
1668,SPAR WESTERN CAPE,2910769,2531,6001008777271,SPAR SPICE B/WORS K/BERG,1KG
1668,SPAR WESTERN CAPE,2910825,2532,6001008777295,SPAR YB SPICE BEEF BURGER 1KG,1KG
1668,SPAR WESTERN CAPE,2910827,2533,6001008777288,SPAR SPICE CHGRILL BURGER,1KG
1668,SPAR WESTERN CAPE,2910859,2534,6001008777301,SPAR YB SPICE BEEF SAUSAGE 1KG,1KG
1668,SPAR WESTERN CAPE,2910862,2535,6001008777578,SPAR SPICE PORK SAUSAGES,1KG
1668,SPAR WESTERN CAPE,2233559,21459,60611042732686,WLP PORK BACK SPECK,P/KG
1668,SPAR WESTERN CAPE,2233560,21460,60611042733362,WLP PORK SPECK SOFT,P/KG
1668,SPAR WESTERN CAPE,2575260,21461,,SPAR YB PORK LEG B/IN P/KG,P/KG
1668,SPAR WESTERN CAPE,2575265,21462,,SPAR YB PORK SHLDR B/IN P/KG,P/KG
1668,SPAR WESTERN CAPE,2849578,21463,6001008717703,SPAR SLT PORK EISBEIN RAW,P/KG
1668,SPAR WESTERN CAPE,2575270,21464,,SPAR YB PORK TRIMS 90/11 P/KG,P/KG
1668,SPAR WESTERN CAPE,2575277,21465,,SPAR YB PORK BELLY B/LES P/KG,P/KG
1668,SPAR WESTERN CAPE,2575297,21466,,SPAR YB PORK LOIN WHOLE P/KG,P/KG
1668,SPAR WESTERN CAPE,2575307,21467,,SPAR YB PORK NECK WHOLE P/KG,P/KG
1668,SPAR WESTERN CAPE,2575315,21468,,SPAR YB PORK WHOLE B/IN P/KG,P/KG
1668,SPAR WESTERN CAPE,2575331,21469,,SPAR YB PORK HOCKS P/KG,P/KG
1668,SPAR WESTERN CAPE,2575332,21470,212274,PORK BELLY ROAST BONE-IN,P/KG
1668,SPAR WESTERN CAPE,2575333,21471,6001008717895,SPAR YB PORK SPARERIB P/KG,P/KG
1668,SPAR WESTERN CAPE,2575397,21472,6001008718151,SPAR YB PORK FILLET 10 P/KG,P/KG
1668,SPAR WESTERN CAPE,2575732,21473,,SPAR YB PORK TRIMS 80/20 P/KG,P/KG
1668,SPAR WESTERN CAPE,2855137,21474,,WLP SIX CUT FRONT QUATER,P/KG
1668,SPAR WESTERN CAPE,2855142,21475,,WLP SIX CUT MIDDLE QUATER,P/KG
1668,SPAR WESTERN CAPE,2855147,21476,,WLP SIX CUT HIND QUATER,P/KG
1668,SPAR WESTERN CAPE,2891542,21477,,WLP PORK TRIMMINGS 70/30,P/KG
1668,SPAR WESTERN CAPE,2924807,21478,6001000120709,WLP PORK RIND OF BI LOIN,P/KG
65,WINELANDS PORK (LABELLE ST)PTY,11320,21479,,WLP PORK TROTTERS,P/KG
1668,SPAR WESTERN CAPE,3000877,21480,,WLP PORK HEARTS FRZ,P/KG
1668,SPAR WESTERN CAPE,3000879,21481,,WLP PORK TAILS FRZ,P/KG
1668,SPAR WESTERN CAPE,3000881,21482,,WLP PORK NECK BONE IN FRZ,P/KG
1668,SPAR WESTERN CAPE,3000885,21483,,WLP PORK CHOPS SHLDR T/PK,P/KG
1668,SPAR WESTERN CAPE,3024086,21484,,WINELANDS PORK SKINS,P/KG
1668,SPAR WESTERN CAPE,2058168,21679,,CHICKEN LEG QUARTER FROZ,P/KG
1668,SPAR WESTERN CAPE,2811650,21680,7896419705215,ETLIN CHIC FILLETS FRZ,15KG
1668,SPAR WESTERN CAPE,2829862,21681,700083893772,ETLIN MEAT DEBONED MECHAN,20KG
1668,SPAR WESTERN CAPE,2829916,21682,700083893789,ETLIN SPARE RIB PORK FZN,10KG
1668,SPAR WESTERN CAPE,2830458,21683,700083893796,ETLIN BEEF OXTAIL,10KG
1668,SPAR WESTERN CAPE,2830848,21684,700083893802,ETLIN CHIC FILLETS,12KG
1668,SPAR WESTERN CAPE,2844063,21685,,ETLIN RIBS PORK SPARE FRZ,P/KG
1668,SPAR WESTERN CAPE,2845677,21686,606110402378,ETLIN SEARA MDM,17.5K
1668,SPAR WESTERN CAPE,2849681,21687,606110415187,ETLIN CHIC LEG DEBONED,15KG
1159,HUMEAT IMPORT&EXPORT (PTY) LTD,A21000,21688,606110422833,ETLIN CHIC SAHA MDM,15KG
1668,SPAR WESTERN CAPE,2860352,21689,606110444033,ETLIN SHEEP LIVER FROZEN,27.2K
1668,SPAR WESTERN CAPE,2881788,21690,606110203630,ETLIN TRIPE BEEF FROZEN,27.2K
1668,SPAR WESTERN CAPE,2893271,21691,,ETLIN CHIC CARCASSES FRZ,P/KG
1668,SPAR WESTERN CAPE,2907064,21692,,ETLIN CHIC DRUMSTICKS FRZ,P/KG
1668,SPAR WESTERN CAPE,2907066,21693,,ETLIN PORK TAILS FROZEN,P/KG
1668,SPAR WESTERN CAPE,2933660,21694,606110079709,ETLIN CHIC LEGS B/L S/O,12KG
1668,SPAR WESTERN CAPE,2741367,21941,,SPAR YB OSTRICH NECK P/KG,P/KG
1668,SPAR WESTERN CAPE,2842548,21942,,K/KAROO OSTRICH S/LN TRIM,15KG
1668,SPAR WESTERN CAPE,2842593,21943,,K/KAROO OSTRICH TRIM FRZ,15KG
1668,SPAR WESTERN CAPE,2842595,21944,,K/KAROO OSTRICH NECK FRZ,10KG
1668,SPAR WESTERN CAPE,2898125,22065,,RIBCORE XMAS HAMPER G&T,P/KG
1668,SPAR WESTERN CAPE,2898129,22066,,RIBCORE TONGUE,P/KG
1668,SPAR WESTERN CAPE,3001379,22067,,RIBCOR EISBEIN SMOKED FRZ,P/KG
1668,SPAR WESTERN CAPE,2962615,22131,,TOMIS TRIPE BEEF CLN FRZ,P/KG
1668,SPAR WESTERN CAPE,2968918,22132,6009900414140,TOMIS BEEF TRIM 90/10 FRZ,P/KG
1668,SPAR WESTERN CAPE,2968929,22133,,TOMIS BEEF TRIM 90/10 FRS,P/KG
1668,SPAR WESTERN CAPE,2968944,22134,,TOMIS BEEF SHORTRIB FRESH,P/KG
1668,SPAR WESTERN CAPE,2968952,22135,,TOMIS BEEF BRISKET A FRSH,P/KG
1668,SPAR WESTERN CAPE,2968971,22136,,TOMIS BEEF CHUCK A FRSH,P/KG
1668,SPAR WESTERN CAPE,2968999,22137,,TOMIS HEEL LEW SKILP FRZ,P/KG
1668,SPAR WESTERN CAPE,2908655,22381,,O/BERG TURKEY WHOLE FRZ,P/KG
1668,SPAR WESTERN CAPE,2910292,22382,,O/BERG PORK BELLY RIB FRZ,P/KG
1668,SPAR WESTERN CAPE,2911458,22383,,O/BERG PORK BELLY OFFCUT,P/KG
1668,SPAR WESTERN CAPE,2911879,22384,,O/BERG PORK BELLY RIBS FZ,P/KG
1668,SPAR WESTERN CAPE,2925157,22385,,O/BERG OXTAIL FRZ,P/KG
1668,SPAR WESTERN CAPE,2932391,22386,,O/BERG CHIC THIGH FRZ DAN,P/KG
1668,SPAR WESTERN CAPE,2937217,22387,,O/BERG PORK TAILBONES,P/KG
1668,SPAR WESTERN CAPE,2953648,22388,,O/BERG CHIC LEG 1/4 SPLIT,P/KG
1668,SPAR WESTERN CAPE,2966252,22389,,D/GROWN RIB PORK BACK END,P/KG
1668,SPAR WESTERN CAPE,2971501,22390,,DANPO CHIC LEG QUART IQF,P/KG
1668,SPAR WESTERN CAPE,2540266,22391,6009802289983,LAZENA CHICKEN SOUP PACK,1KG
1668,SPAR WESTERN CAPE,3049021,22392,,LAZENA CHIC CHUNKS FRZ,P/KG
1668,SPAR WESTERN CAPE,2759812,22393,707273556394,AFRIPES BEEF TAILS FRZ,10KG
1668,SPAR WESTERN CAPE,3112323,22394,781718556552,HUME TURKEY D/STICKS MALE,15KG
1668,SPAR WESTERN CAPE,3115584,22395,781718556606,HUME CHICKEN MDM,10KG
1668,SPAR WESTERN CAPE,3117990,22396,781718556569,HUME PORK RIBS,10KG
1668,SPAR WESTERN CAPE,2693445,22422,6009803741510,SAUCE ON TAP S/DIP&C/DESS,10LT
1668,SPAR WESTERN CAPE,3034591,22423,6009881118075,SOT BILTONG & DROEW P/MIX,10LT
1668,SPAR WESTERN CAPE,2571313,22424,6001008716119,SPAR T&T PICKLED TONGUE,P/KG
1668,SPAR WESTERN CAPE,2571316,22425,,SPAR T&T SALT BEEF,P/KG
1668,SPAR WESTERN CAPE,2573037,22426,6001008716386,SPARTA BEEF LUNGS,P/KG
1668,SPAR WESTERN CAPE,2573103,22427,6001008716447,SPARTA BEEF LIVER,P/KG
1668,SPAR WESTERN CAPE,2573115,22428,6001008716478,SPARTA BEEF HEARTS,P/KG
1668,SPAR WESTERN CAPE,2573131,22429,6001008716515,SPARTA BEEF NECK MEAT,P/KG
1668,SPAR WESTERN CAPE,2573137,22430,6001008716539,SPARTA OX TAILS,P/KG
1668,SPAR WESTERN CAPE,2573313,22431,6001008716614,SPARTA BEEF TONGUE,P/KG
1668,SPAR WESTERN CAPE,2573317,22432,6001008716638,SPARTA BEEF CHEECK MEAT,P/KG
1668,SPAR WESTERN CAPE,2573476,22433,6001008716737,SPARTA BEEF TRIPE CLEAN,P/KG
1668,SPAR WESTERN CAPE,2573492,22434,6001008716812,SPARTA BEEF SHIN BONELESS,P/KG
1668,SPAR WESTERN CAPE,2573716,22435,6001008716935,SPARTA BEEF SIRLOIN AB,P/KG
1668,SPAR WESTERN CAPE,2573721,22436,6001008716973,SPARTA BEEF RUMP AB,P/KG
1668,SPAR WESTERN CAPE,2573723,22437,6001008716997,SPARTA BEEF RUMP TAIL,P/KG
1668,SPAR WESTERN CAPE,2573833,22438,6001008717116,SPARTA BEEF MARROW BONES,P/KG
1668,SPAR WESTERN CAPE,2573841,22439,6001008717130,SPARTA BEEF SUET,P/KG
1668,SPAR WESTERN CAPE,2573845,22440,6001008717154,SPARTA BEEF BODY FAT,P/KG
1668,SPAR WESTERN CAPE,2573859,22441,6001008717178,SPARTA BEEF SHIN BONE IN,P/KG
1668,SPAR WESTERN CAPE,2573872,22442,6001008718397,SPARTA BEEF FLANKS 70VL,P/KG
1668,SPAR WESTERN CAPE,2573874,22443,6001008717215,SPARTA BEEF CROPS 95VL,P/KG
1668,SPAR WESTERN CAPE,2573884,22444,6001008717277,SPARTA BEEF BRISKET B/IN,P/KG
1668,SPAR WESTERN CAPE,2573890,22445,6001008717291,SPARTA BEEF CHUCK BONE IN,P/KG
1668,SPAR WESTERN CAPE,2573900,22446,6001008717321,SPARTA BRISKET BONELESS,P/KG
1668,SPAR WESTERN CAPE,2573962,22447,6001008717420,SPARTA BEEF RIB FLAT,P/KG
1668,SPAR WESTERN CAPE,2573979,22448,6001008717482,SPARTA BEEF FLNK STK THCK,P/KG
1668,SPAR WESTERN CAPE,2575309,22449,6001008717888,SPAR YB BEEF TRIM 90/10 P/KG,P/KG
1668,SPAR WESTERN CAPE,2575318,22450,6001008717918,SPAR YB BEEF TRIM 80/20 P/KG,P/KG
1668,SPAR WESTERN CAPE,2575350,22451,6001008717994,SPAR YB BEEF FILLET P/KG,P/KG
1668,SPAR WESTERN CAPE,2575352,22452,6001008718007,SPAR YB BEEF SHIN B/LESS P/KG,P/KG
1668,SPAR WESTERN CAPE,2575354,22453,6001008718014,SPAR YB BEEF SIRLOIN P/KG,P/KG
1668,SPAR WESTERN CAPE,2575355,22454,6001008718021,SPAR YB BEEF SILVERSIDE P/KG,P/KG
1668,SPAR WESTERN CAPE,2575357,22455,6001008718038,SPAR YB BEEF SOFT SHIN P/KG,P/KG
1668,SPAR WESTERN CAPE,2575358,22456,6001008718045,SPAR YB BEEF TOPSIDE P/KG,P/KG
1668,SPAR WESTERN CAPE,2575359,22457,6001008718052,TENDER&TASTY TEXAN STEAK,P/KG
1668,SPAR WESTERN CAPE,2575360,22458,6001008718069,SPAR T&T BEEF ESPETADA,P/KG
1668,SPAR WESTERN CAPE,2575364,22459,6001008718083,TENDER & TASTY BEEF KEBAB,P/KG
1668,SPAR WESTERN CAPE,2575367,22460,6001008718090,SPAR YB BEEF OX TAILS P/KG,P/KG
1668,SPAR WESTERN CAPE,2575374,22461,6001008718106,SPAR YB BEEF KNUCKLE P/KG,P/KG
1668,SPAR WESTERN CAPE,2575382,22462,6001008718120,SPAR YB BEEF RUMP P/KG,P/KG
1668,SPAR WESTERN CAPE,2592863,22463,6001008720512,SPAR YB BEEF CHUCK B/IN P/KG,P/KG
1668,SPAR WESTERN CAPE,2592869,22464,6001008720536,SPAR YB BEEF BRISKT B/IN P/KG,P/KG
1668,SPAR WESTERN CAPE,2592886,22465,6001008720543,SPAR YB BEEF SHORT RIB P/KG,P/KG
1668,SPAR WESTERN CAPE,2595551,22466,6001008720581,SPAR SLT BEEF COW HEELS,1.5KG
1668,SPAR WESTERN CAPE,2611530,22467,,SPAR YB BEEF RIB EYE P/KG,P/KG
1668,SPAR WESTERN CAPE,2611581,22468,,SPAR YB BEEF CLUB STEAK P/KG,P/KG
1668,SPAR WESTERN CAPE,2611589,22469,,SPAR YB BEEF SHIN B/IN P/KG,P/KG
1668,SPAR WESTERN CAPE,2611591,22470,6001008725807,SPAR SLT BEEF NECK STEW,P/KG
1668,SPAR WESTERN CAPE,2611593,22471,,SPAR YB BEEF TBONE STEAK P/KG,P/KG
1668,SPAR WESTERN CAPE,2681025,22472,212241,SPAR YB BEEF CLUB/TBONE P/KG,P/KG
1668,SPAR WESTERN CAPE,2686731,22473,,SPAR SLT BEEF PRIME RIB,P/KG
1668,SPAR WESTERN CAPE,2698631,22474,700112521560,SPARTA SHORT FILLET VAC,18P/K
1668,SPAR WESTERN CAPE,2704320,22475,,SPARTA PRIME RIB CHICAGO,4P/KG
1668,SPAR WESTERN CAPE,2801737,22476,6001008767241,T&T MEGA BURGER JALAPENO,520GR
1668,SPAR WESTERN CAPE,2802346,22477,7000835311558,T&T STEAK PREGO,P/KG
1668,SPAR WESTERN CAPE,2802348,22478,7000835310940,T&T CURRY SOSATIE,P/KG
1668,SPAR WESTERN CAPE,2842348,22479,,SPARTA SHORT RIB FROZEN,P/KG
1668,SPAR WESTERN CAPE,2857915,22480,,SPAR STEAK CO PORTERHOUSE,P/KG
1668,SPAR WESTERN CAPE,2859505,22481,2858096132468,SPAR STEAK CO RIB EYE,P/KG
1668,SPAR WESTERN CAPE,2859507,22482,,SPAR STEAK CO T BONE,P/KG
1668,SPAR WESTERN CAPE,2859513,22483,2858063121198,SPAR STEAK CO SIRLOIN,P/KG
1668,SPAR WESTERN CAPE,2859521,22484,2858029116794,SPAR STEAK CO RUMP,P/KG
1668,SPAR WESTERN CAPE,2859524,22485,,SPAR STEAK CO PICANHA,P/KG
1668,SPAR WESTERN CAPE,2859526,22486,,SPAR STEAK CO LEAN RUMP,P/KG
1668,SPAR WESTERN CAPE,2859528,22487,,SPAR STEAK CO WHL FILLET,P/KG
1668,SPAR WESTERN CAPE,2859530,22488,2858074113892,SPAR STEAK CO SIRLOIN BNE,P/KG
1668,SPAR WESTERN CAPE,2882935,22489,,T&T STEAK TEXAN MINI,P/KG
1668,SPAR WESTERN CAPE,2882937,22490,6001008486142,SPAR STEAK CO FILLET MEDA,P/KG
1668,SPAR WESTERN CAPE,2910745,22491,7000835312470,W/VIEW BURGER BEEF WAGYU,600GR
1668,SPAR WESTERN CAPE,2910749,22492,7000835312302,SPARTA BURGER BEEF ANGUS,600GR
1668,SPAR WESTERN CAPE,2934037,22493,,SPARTA ANGUS RUMP STEAK,P/KG
1668,SPAR WESTERN CAPE,2934041,22494,,SPARTA ANGUS RUMP MEDALL,P/KG
1668,SPAR WESTERN CAPE,2934046,22495,,SPARTA ANGUS SIRLOIN RP,P/KG
1668,SPAR WESTERN CAPE,2934688,22496,,SPARTA ANGUS BAVETT STEAK,P/KG
1668,SPAR WESTERN CAPE,2964946,22497,,T&T RIB EYE ROAST,P/KG
1668,SPAR WESTERN CAPE,3021639,22498,,SPAR STEAK CO RUMP ROAST,P/KG
1668,SPAR WESTERN CAPE,3021650,22499,,SPAR STEAK CO STEAK TOMH,P/KG
1668,SPAR WESTERN CAPE,3021657,22500,2858088139192,SPAR STEAK CO RUMP MEDALL,P/KG
1668,SPAR WESTERN CAPE,3079735,22501,,SPAR STEAK CO RUMP&SIRLOI,P/KG
1668,SPAR WESTERN CAPE,3085261,22502,,SPARTA STOMACH FAT,P/KG
1668,SPAR WESTERN CAPE,3111054,22503,,SPAR STEAK CO HALF FILLET,P/KG
1668,SPAR WESTERN CAPE,3111841,22504,,ANGUS STEAK DENVER,P/KG
1668,SPAR WESTERN CAPE,3409942,22505,,SPAR T&T FILLET PEPP CRUSTED P,1KG
1668,SPAR WESTERN CAPE,3409943,22506,2858098168724,SPAR STEAK CO BAVETTE PLANKIE,1KG
1668,SPAR WESTERN CAPE,3414602,22507,,SPAR T&T BEEF FQ SPIC&SLC MIX,1KG
1668,SPAR WESTERN CAPE,2406776,22512,6001008686481,SPAR T&T 3 PIECE BOX,P/KG
1668,SPAR WESTERN CAPE,2406778,22513,6001008686474,SPAR T&T 2 PIECE BOX,P/KG
1668,SPAR WESTERN CAPE,2524506,22516,6001008701603,SPAR T&T PORK S/RIB SWT&S,1KG
1668,SPAR WESTERN CAPE,2570932,22518,212310,SPAR TENDER&TASTY GAMMON,P/KG
1668,SPAR WESTERN CAPE,2571324,22519,6001008716133,SPAR T&T GMMN UNCKD BLESS,P/KG
1668,SPAR WESTERN CAPE,2571616,22520,,SPAR T&T GMMN COOKD BNLSS,P/KG
1668,SPAR WESTERN CAPE,2801729,22573,6001008767227,T&T MEGA BURGER,520GR
1668,SPAR WESTERN CAPE,2801733,22574,6001008767234,T&T MEGA BURGER CHEESE,520GR
1668,SPAR WESTERN CAPE,2820823,22582,,SPAR SC BEEF BONE IN CUBE,P/KG
1668,SPAR WESTERN CAPE,2820872,22583,,SPAR SC BEEF BONELESS CUB,P/KG
1668,SPAR WESTERN CAPE,2821014,22584,,SPAR SC BEEF STRIPS,P/KG
1668,SPAR WESTERN CAPE,2843592,22595,6001008777509,T&T RIBS HONEY&SOY,1KG
1668,SPAR WESTERN CAPE,2844258,22596,,SPAR CASING SHEEP THIN,1'S
1668,SPAR WESTERN CAPE,2844260,22597,,SPAR CASING SHEEP THICK,1'S
1668,SPAR WESTERN CAPE,2844968,22598,6001008777943,SPAR MARINADE HNEY&MUSTRD,10KG
1668,SPAR WESTERN CAPE,2844972,22599,6001008777950,SPAR MARINADE BBQ,10KG
1668,SPAR WESTERN CAPE,2844974,22600,6001008777967,SPAR MARINADE LEMON&HERB,10KG
1668,SPAR WESTERN CAPE,2844976,22601,6001008777974,SPAR MARINADE ROSEM/RWINE,10KG
1668,SPAR WESTERN CAPE,2844978,22602,6001008777981,SPAR MARINADE SOSATIE,10KG
1668,SPAR WESTERN CAPE,2844980,22603,6001008777998,SPAR MARINADE PERI PERI,10KG
1668,SPAR WESTERN CAPE,2844982,22604,6001008778001,SPAR MARINADE SWEET CHILI,10KG
1668,SPAR WESTERN CAPE,2844984,22605,6001008778018,SPAR MARINADE SWEET&SOUR,10KG
1668,SPAR WESTERN CAPE,2871778,22607,6001008784675,T&T RIBS BEEF BBQ,1KG
1668,SPAR WESTERN CAPE,2928577,22617,212295,T&T TONGUE/GAMON BOX,P/KG
1668,SPAR WESTERN CAPE,2930564,22618,6001008796227,SPAR MARINADE BBQ&MUSTARD,10KG
1668,SPAR WESTERN CAPE,2932094,22619,6001008796388,T&T BACON BACK,650GR
1668,SPAR WESTERN CAPE,2932098,22620,6001008796395,T&T BACON STREAKY,650GR
1668,SPAR WESTERN CAPE,2932112,22621,,T&T KASSLER STEAKS,P/KG
1668,SPAR WESTERN CAPE,2962266,22623,,SPAR YB PORK KEBABS P/KG,P/KG
1668,SPAR WESTERN CAPE,2962273,22624,,T&T PORK RIBS SMKD,P/KG
1668,SPAR WESTERN CAPE,2964231,22625,,SPAR YB CHICK KEBABS P/KG,P/KG
1668,SPAR WESTERN CAPE,2987363,22627,6001008796401,T&T WORS BACON & CHEESE,420GR
1668,SPAR WESTERN CAPE,2990687,22628,6001008808913,T&T BACON SHOULDER,650GR
1668,SPAR WESTERN CAPE,2990693,22629,6001008808920,T&T BACON DICED,650GR
1668,SPAR WESTERN CAPE,2990695,22630,,T&T PORK NECK STEAKS,P/KG
1668,SPAR WESTERN CAPE,2998050,22631,,T&T PORK BELLY ROAST,P/KG
1668,SPAR WESTERN CAPE,2998052,22632,,T&T PORK NECK ROAST,P/KG
1668,SPAR WESTERN CAPE,3037682,22634,6001008820472,SPAR YB OSTRICH BURGER 400GR,400GR
1668,SPAR WESTERN CAPE,3038068,22635,6001008753213,SPAR YB OSTRICH MINCE 400GR,400GR
1668,SPAR WESTERN CAPE,3038082,22636,6001008753169,SPAR YB OSTRICH STEAK 400GR,400GR
1668,SPAR WESTERN CAPE,3038084,22637,6001008753183,SPAR SLT OSTRICH STIRFRY,400GR
1668,SPAR WESTERN CAPE,3038086,22638,6001008753190,SPAR YB OSTRICH FILLET 400GR,400GR
1668,SPAR WESTERN CAPE,3038088,22639,6001008753176,SPAR SLT OSTRICH GOULASH,400GR
1668,SPAR WESTERN CAPE,3074298,22646,6001008827419,T&T SCE LEMON&HERB,250ML
1668,SPAR WESTERN CAPE,3074303,22647,6001008827426,T&T SCE BBQ&MUSTARD SEED,250ML
1668,SPAR WESTERN CAPE,3074310,22648,,T&T SCE CREAMY PERI PERI,250ML
1668,SPAR WESTERN CAPE,3074311,22649,6001008827433,T&T SCE CREAMY PERI PERI,250ML
1668,SPAR WESTERN CAPE,3074316,22650,6001008827440,T&T SCE SOSATIE,250ML
1668,SPAR WESTERN CAPE,3074321,22651,6001008827457,T&T SCE STEAKHOUSE BBQ,250ML
1668,SPAR WESTERN CAPE,3074336,22652,6001008827464,T&T DROEWORS ORIGINAL,80GR
1668,SPAR WESTERN CAPE,3074340,22653,6001008827471,T&T SNAPSTICKS CHILLI,80GR
1668,SPAR WESTERN CAPE,3074344,22654,6001008827488,T&T SNAPSTICKS ORIGINAL,80GR
1668,SPAR WESTERN CAPE,3074348,22655,6001008827495,T&T BILTONG CHILLI SLC,80GR
1668,SPAR WESTERN CAPE,3074352,22656,6001008827501,T&T BILTONG ORIGINAL SLC,80GR
1668,SPAR WESTERN CAPE,3074401,22657,6001008827518,T&T DROEWORS ORIGINAL,150GR
1668,SPAR WESTERN CAPE,3074405,22658,6001008827525,T&T SNAPSTICKS ORIGINAL,150GR
1668,SPAR WESTERN CAPE,3074409,22659,6001008827532,T&T BILTONG ORIGINAL SLC,150GR
1668,SPAR WESTERN CAPE,3078571,22660,6001008827945,T&T GRINDER STEAK&CHOPS,130GR
1668,SPAR WESTERN CAPE,3078579,22661,6001008827952,T&T GRINDER SMOKEY BBQ,130GR
1668,SPAR WESTERN CAPE,3078591,22662,6001008827969,T&T SPICE MEATY BBQ,125GR
1668,SPAR WESTERN CAPE,3078595,22663,6001008827976,T&T SPICE TEXAN STEAK,125GR
1668,SPAR WESTERN CAPE,3078655,22664,6001008827983,T&T SPICE GARLIC & HERB,125GR
1668,SPAR WESTERN CAPE,3102901,22680,6001008831416,T&T WORS BACON CHSE CHIL,420GR
1668,SPAR WESTERN CAPE,3102957,22681,6001008831423,SPAR S/BUTCH SPICE G/BEEF,1KG
1668,SPAR WESTERN CAPE,3102967,22682,6001008831430,SPAR S/BUTCH SPICE C/BURG,1KG
1668,SPAR WESTERN CAPE,3111329,22685,6001008833076,SPAR CV SPICE BRAAIWORS 3KG,3KG
1668,SPAR WESTERN CAPE,3114426,22686,6001008833113,SPAR T&T B/BUST CHS/ONION,330GR
1668,SPAR WESTERN CAPE,3114427,22687,6001008833120,SPAR T&T B/BUST CHILI/CHS,330GR
1668,SPAR WESTERN CAPE,3114431,22688,6001008833137,SPAR T&T B/BUST GARL/PARS,330GR
1668,SPAR WESTERN CAPE,3114436,22689,,SPAR T&T SMK CHCK FILLET,P/KG
1668,SPAR WESTERN CAPE,3118075,22692,,SPAR T&T C/CHIC STRIPS,P/KG
1668,SPAR WESTERN CAPE,3118082,22693,,SPAR T&T C/CHIC SCHNITZEL,P/KG
1668,SPAR WESTERN CAPE,3118090,22694,,SPAR T&T C/CHIC BURGERS,P/KG
1668,SPAR WESTERN CAPE,3121178,22695,2858043394222,SPAR T&T BBQ PORK BURGER,600GR
1668,SPAR WESTERN CAPE,3127095,22696,,SPAR T&T DBD LEG OF LAMB,P/KG
1668,SPAR WESTERN CAPE,3409898,22706,212277,SPAR T&T CHIC SKPDJIES FR P/KG,1KG
1668,SPAR WESTERN CAPE,3409899,22707,,SPAR T&T LAMB SKPDJIES FR P/KG,1KG
1668,SPAR WESTERN CAPE,3417903,22716,,SPAR SLT OSTRICH SHANKS BULK F,1KG
1668,SPAR WESTERN CAPE,3426363,22720,,SPAR T&T BEEF D/WORS BULK P/KG,1KG
1668,SPAR WESTERN CAPE,3426368,22721,,SPAR T&T BEEF BILTONG BULK P/K,1KG
1668,SPAR WESTERN CAPE,3428317,22722,6001008846243,SPAR T&T P/BELLY RIB 1KG BBQ,1KG
1668,SPAR WESTERN CAPE,3428318,22723,6001008846250,SPAR T&T P/BELLY RIB 1KG S&STK,1KG
1668,SPAR WESTERN CAPE,3428344,22724,6001008846267,SPAR T&T P/LOIN RIB 1KG BBQ,1KG
1668,SPAR WESTERN CAPE,3428345,22725,6001008846274,SPAR T&T P/LOIN RIB 1KG S&STKY,1KG
1668,SPAR WESTERN CAPE,3434200,22727,,SPAR T&T PORK NCK STK SW&ST P/,3.78K
1668,SPAR WESTERN CAPE,3434201,22728,,SPAR T&T PORK NCK STK SPCY P/K,1KG
1668,SPAR WESTERN CAPE,2953112,22833,,C/MEAT CROPS FROZEN 90/10,P/KG
1668,SPAR WESTERN CAPE,2231740,22834,6005120000620,BRM BEEF RIBS BBQ,15KG
1668,SPAR WESTERN CAPE,2231743,22835,6005120000637,BRM BRANDS LAMB RIBS BBQ,15KG
1668,SPAR WESTERN CAPE,2611258,22836,6005120000446,BRM PORK LOIN RIB BBQ,700GR
1668,SPAR WESTERN CAPE,2611436,22837,6005120001030,BRM PORK BELLY RIBS MX BB,15KG
1668,SPAR WESTERN CAPE,2611457,22838,6005120001016,BRM PORK LOIN RIBS L BBQ,15KG
501,BARBEQUE RIB MNFG (PTY) LTD,BELLY,22839,6005120000897,BRM PORK BELLY RIB BBQ,1KG
1668,SPAR WESTERN CAPE,2818946,22840,6005120000842,BRM RIBS PORK BELLY BBQ,2KG
1668,SPAR WESTERN CAPE,2818948,22841,6005120000941,BRM BEEF RIBS BBQ,2KG
501,BARBEQUE RIB MNFG (PTY) LTD,P702P,22842,6005120001290,BRM PORK PULL S&STCK BBQ,500GR
1668,SPAR WESTERN CAPE,2818952,22843,6005120000354,BRM LAMB RIBS BBQ,800GR
1668,SPAR WESTERN CAPE,2819021,22844,6005120000569,BRM PORK LOIN RIBS BBQ,2KG
1668,SPAR WESTERN CAPE,2839770,22845,6005120000408,BRM PORK LOIN RIBS SWT&ST,1KG
1668,SPAR WESTERN CAPE,2839778,22846,6005120000590,BRM BEEF RIBS SWT&STICKY,1KG
501,BARBEQUE RIB MNFG (PTY) LTD,R 201.00,22847,6005120002082,BRM LOIN RIBS,1KG
1668,SPAR WESTERN CAPE,2854591,22848,6005120002068,BRM PORK LOIN RIBS,700GR
1668,SPAR WESTERN CAPE,2854608,22849,6005120001986,BRM BEEF RIBS BBQ,2KG
1668,SPAR WESTERN CAPE,2854611,22850,6005120002105,BRM PORK BELLY RIB,2KG
1668,SPAR WESTERN CAPE,2854623,22851,6005120002129,BRM POK PULLED,500GR
1668,SPAR WESTERN CAPE,2854649,22852,6005120002006,BRM LAMB RIBS BBQ,800GR
1668,SPAR WESTERN CAPE,2854733,22853,6005120002044,BRM PORK LION RIBS BBQ,2KG
1668,SPAR WESTERN CAPE,2859584,22854,6005120002020,BRM EX PORK LOIN RIB FRZ,1KG
1668,SPAR WESTERN CAPE,2859588,22855,6005120001962,BRM BEEF RIB FROZEN,1KG
1668,SPAR WESTERN CAPE,2878509,22856,6005120001948,BRM PORK BELLY RIB BBQ,700GR
1668,SPAR WESTERN CAPE,2957776,22857,6005120002297,BRM CHIC WINGS BBQ,800GR
1668,SPAR WESTERN CAPE,2957810,22858,6005120002341,BRM CHIC LEG QUART P/PERI,650GR
1668,SPAR WESTERN CAPE,2957816,22859,6005120002327,BRM CHIC LEG QUART BBQ,650GR
1668,SPAR WESTERN CAPE,2958008,22860,6005120002303,BRM CHIC WINGS L&H,800GR
1668,SPAR WESTERN CAPE,2975303,22861,6005120003232,BRM PORK SPARE RIBS IBS,1KG
1668,SPAR WESTERN CAPE,2975307,22862,6005120003249,BRM PORK SPARE RIBS IBS,2KG
1668,SPAR WESTERN CAPE,2734102,22907,212341,WOODY EISBEIN SMOKED,P/KG
1668,SPAR WESTERN CAPE,2862171,22908,,MR CRUMBS CHIC STRIP BLUK,P/KG
1668,SPAR WESTERN CAPE,2862188,22909,,MR CRUMBS CHIC BURGR BULK,P/KG
1668,SPAR WESTERN CAPE,2862190,22910,,MR CRUMBS CHIC NUGGET BLK,P/KG
1668,SPAR WESTERN CAPE,2862192,22911,,MR CRUMBS CHIC POPS BULK,P/KG
1668,SPAR WESTERN CAPE,2862194,22912,,MR CRUMBS CHIC STEAK BULK,P/KG
1668,SPAR WESTERN CAPE,2862195,22913,,MR CRUMBS CHIC SCHNIT BLK,P/KG
1668,SPAR WESTERN CAPE,2862408,22914,,MR CRUMBS CHIC SCHNIZ FRM,P/KG
1668,SPAR WESTERN CAPE,2870652,22915,,WOODYS RIBS SHOULDER FRZ,P/KG
1668,SPAR WESTERN CAPE,2880392,22916,,MR CRUMBS PORK SCHZL BULK,P/KG
1668,SPAR WESTERN CAPE,2880393,22917,,MR CRUMBS PORK STRIP FRZ,P/KG
1668,SPAR WESTERN CAPE,2880402,22918,,MR CRUMBS BACON POPS FRZ,P/KG
1668,SPAR WESTERN CAPE,2880404,22919,,MR CRUMBS PORK BURGER BLK,P/KG
1668,SPAR WESTERN CAPE,2880412,22920,,MR CRUMBS PORK CHOP B/LES,P/KG
1668,SPAR WESTERN CAPE,2880414,22921,,MR CRUMBS JALAP&CHSE POP,P/KG
1668,SPAR WESTERN CAPE,2888935,22922,,MR CRUMBS CHIC BRST BLK F,P/KG
1668,SPAR WESTERN CAPE,2888937,22923,,MR CRUMBS BRAAI CHIC BURG,P/KG
1668,SPAR WESTERN CAPE,2888941,22924,,MR CRUMBS PORK RIBS MARIN,P/KG
1668,SPAR WESTERN CAPE,2893842,22925,,MR CRUMBS CHIC FINGER FRZ,P/KG
1668,SPAR WESTERN CAPE,2903979,22926,,MR CRUMBS CHIC STK CHS BU,P/KG
1668,SPAR WESTERN CAPE,2975848,22966,,DRM CHIC CRUMBED SCHNITZE,P/KG
1668,SPAR WESTERN CAPE,2975988,22967,,DRM CHIC CRMB STRIPS,P/KG
1668,SPAR WESTERN CAPE,2975989,22968,,DRM CHIC CRMB BREAST,P/KG
1668,SPAR WESTERN CAPE,2975991,22969,,DRM CHIC CRMB NUGGETS,P/KG
1668,SPAR WESTERN CAPE,2975993,22970,,DRM CHIC CRMB BURGER,P/KG
1668,SPAR WESTERN CAPE,2975995,22971,,DRM CHIC CRUMBED STEAKLET,P/KG
1668,SPAR WESTERN CAPE,2975997,22972,,DRM CHIC CRMB REF SCHNITZ,P/KG
1668,SPAR WESTERN CAPE,2762892,22973,,MATADOR CHIC THIGH KEBABS,P/KG
1668,SPAR WESTERN CAPE,3121832,22974,6009607170462,CHOOKS CHIC BRAAIPACK FRZ,600GR
1668,SPAR WESTERN CAPE,2575263,22975,,SPAR YB BEEF TRIM 90/10 P/KG,P/KG
1668,SPAR WESTERN CAPE,2823633,22976,,MALU SHOULDER N/OUT FRZ,P/KG
1668,SPAR WESTERN CAPE,2843418,22977,,MALU PORK FILLET LRG FRZ,P/KG
1668,SPAR WESTERN CAPE,2844361,22978,,MALU PORK NECK BONES FRZ,P/KG
1668,SPAR WESTERN CAPE,2849564,22979,,MALU PORK TROTTERS FRZN,P/KG
1668,SPAR WESTERN CAPE,2849566,22980,,MALU PORK SPINE BONES FRZ,P/KG
1668,SPAR WESTERN CAPE,2866370,22981,,MALU PORK TAIL FROZEN,P/KG
1668,SPAR WESTERN CAPE,2866393,22982,,MALU PORK RUMP FROZEN,P/KG
1668,SPAR WESTERN CAPE,2904201,22983,,MALU PORK NECK STEAK FRSH,P/KG
1668,SPAR WESTERN CAPE,2904202,22984,,MALU PORK RUMP STEAK FRSH,P/KG
1668,SPAR WESTERN CAPE,2904205,22985,,MALU PORK BELLY RST B/LES,P/KG
1668,SPAR WESTERN CAPE,2904206,22986,,MALU PORK SIRLOIN STEAK,P/KG
1668,SPAR WESTERN CAPE,2965346,22987,,MALU PORK BUTTOCK FRZ,P/KG
1668,SPAR WESTERN CAPE,2977269,22988,,SPAR YB PRK ESL RASHERS P/KG,P/KG
1668,SPAR WESTERN CAPE,2977271,22989,,SPAR YB PRK ESL SIRLOIN P/KG,P/KG
1668,SPAR WESTERN CAPE,2977273,22990,,SPAR YB PRK ESL RUMP P/KG,P/KG
1668,SPAR WESTERN CAPE,2977275,22991,,SPAR YB ESL FILLET 2S P/KG,P/KG
1668,SPAR WESTERN CAPE,2977277,22992,,SPAR YB ESL MINI RASHER P/KG,P/KG
1668,SPAR WESTERN CAPE,2977279,22993,,SPAR YB ESL NECK STEAKS P/KG,P/KG
1668,SPAR WESTERN CAPE,2977281,22994,,SPAR YB PRK ESL BELLY P/KG,P/KG
1668,SPAR WESTERN CAPE,2977283,22995,,SPAR YB PRK ESL FILLET P/KG,P/KG
1668,SPAR WESTERN CAPE,2995951,22996,,SPAR YB PORK FILLET FRZ P/KG,P/KG
1668,SPAR WESTERN CAPE,2995954,22997,,SPAR YB PORK HOCKS FRZ P/KG,P/KG
1668,SPAR WESTERN CAPE,2995956,22998,,SPAR YB PORK SHLDER FRZ P/KG,P/KG
1668,SPAR WESTERN CAPE,2995958,22999,,SPAR YB PORK NECK FZ P/KG,P/KG
1668,SPAR WESTERN CAPE,2995960,23000,,SPAR YB PORK LOIN RO FRZ P/KG,P/KG
1668,SPAR WESTERN CAPE,2995962,23001,,SPAR YB PORK LOIN DDD FZ P/KG,P/KG
1668,SPAR WESTERN CAPE,2995964,23002,,SPAR YB PORK TRIMMING P/KG,P/KG
1668,SPAR WESTERN CAPE,2995966,23003,,SPAR YB PORK BELLY RO P/KG,P/KG
1668,SPAR WESTERN CAPE,2995968,23004,,SPAR YB PORK BELLY B/LES P/KG,P/KG
